{
  "format": "hoibot-object-db-consumer-execution-receipts-v1",
  "catalogVersion": "SC-20260902-1",
  "classificationBaseCommit": "f97be62292c3f7e8ea79b2d6f302dd25517584d4",
  "evidenceCommit": "3c724f52c257f87f50805ff0957ba9e0a59d0d96",
  "receipts": [
    {
      "receiptId": "receipt:wave1:sql-repository-0dc3c380c54081a2:exact_output",
      "consumerId": "sql-repository-0dc3c380c54081a2",
      "proofMode": "DIRECT",
      "harness": {
        "harnessId": "harness:object-db-executable-parity:wave1",
        "harnessCaseId": "case:canonical-title-list-owned",
        "runner": "NODE_OBJECT_DB_PARITY_V1",
        "path": "개발환경_고도화/runtime/test/fixtures/object-db-executable-parity-harness.mjs",
        "sourceSha256": "bc1eea0a3d301679faba753c0922e9d7de3e1a67842372e74d545b10784b2ed5"
      },
      "fixture": {
        "fixtureId": "fixture:wave1:canonical-title-list-owned:v1",
        "path": "개발환경_고도화/migration-control/fixtures/synthetic-relational/object-db-consumer-executable-parity-wave1-title-list-owned-v1.json",
        "sha256": "e69bb41cd41442741014394812faf7acf5411e4d59ed758f649ddf0a5b29e94d"
      },
      "invocation": {
        "targetPath": "개발환경_고도화/runtime/test/fixtures/object-db-executable-parity-wave1-title-list-owned.mjs",
        "targetSourceSha256": "cf1d6e72f4574ee0b2a85318fd6dfded7bb94a97b006943dce046b95d2f6f0fa",
        "exportName": "executeWave1TitleListOwned"
      },
      "scenario": {
        "scenarioId": "scenario:exact-output",
        "scenarioKind": "EXACT_OUTPUT"
      },
      "expectedActual": {
        "reply": {
          "expectedSha256": "ee4584e8b0cdf207061c71a131185e12ff3adcd8cbf158b8ccaae70f35f25a4a",
          "actualSha256": "ee4584e8b0cdf207061c71a131185e12ff3adcd8cbf158b8ccaae70f35f25a4a",
          "match": true
        },
        "result": {
          "expectedSha256": "ee4584e8b0cdf207061c71a131185e12ff3adcd8cbf158b8ccaae70f35f25a4a",
          "actualSha256": "ee4584e8b0cdf207061c71a131185e12ff3adcd8cbf158b8ccaae70f35f25a4a",
          "match": true
        },
        "dml": {
          "expectedSha256": "217954ae86d3eb2e1a5093f4ef1d72d513b72ce127a286eff02970c2c634c750",
          "actualSha256": "217954ae86d3eb2e1a5093f4ef1d72d513b72ce127a286eff02970c2c634c750",
          "match": true,
          "expectedNormalizedStatements": [],
          "actualNormalizedStatements": [],
          "expectedRowCount": 0,
          "actualRowCount": 0
        },
        "lockOrder": {
          "expected": [],
          "actual": [],
          "match": true
        },
        "transaction": {
          "expected": "READ_ONLY",
          "actual": "READ_ONLY",
          "match": true,
          "expectedTimeline": [
            "READ"
          ],
          "actualTimeline": [
            "READ"
          ]
        }
      },
      "equivalenceRule": null,
      "verdict": "PASS",
      "receiptSha256": "f4819216be8cd05924adaa89b5ff3d5ed2f404e45efb1b4497888f885ec579ce"
    },
    {
      "receiptId": "receipt:wave1:sql-repository-0dc3c380c54081a2:negative_guard",
      "consumerId": "sql-repository-0dc3c380c54081a2",
      "proofMode": "DIRECT",
      "harness": {
        "harnessId": "harness:object-db-executable-parity:wave1",
        "harnessCaseId": "case:canonical-title-list-owned",
        "runner": "NODE_OBJECT_DB_PARITY_V1",
        "path": "개발환경_고도화/runtime/test/fixtures/object-db-executable-parity-harness.mjs",
        "sourceSha256": "bc1eea0a3d301679faba753c0922e9d7de3e1a67842372e74d545b10784b2ed5"
      },
      "fixture": {
        "fixtureId": "fixture:wave1:canonical-title-list-owned:v1",
        "path": "개발환경_고도화/migration-control/fixtures/synthetic-relational/object-db-consumer-executable-parity-wave1-title-list-owned-v1.json",
        "sha256": "e69bb41cd41442741014394812faf7acf5411e4d59ed758f649ddf0a5b29e94d"
      },
      "invocation": {
        "targetPath": "개발환경_고도화/runtime/test/fixtures/object-db-executable-parity-wave1-title-list-owned.mjs",
        "targetSourceSha256": "cf1d6e72f4574ee0b2a85318fd6dfded7bb94a97b006943dce046b95d2f6f0fa",
        "exportName": "executeWave1TitleListOwned"
      },
      "scenario": {
        "scenarioId": "scenario:negative-guard",
        "scenarioKind": "NEGATIVE_GUARD"
      },
      "expectedActual": {
        "reply": {
          "expectedSha256": "b0d9b29cbd36975d787eda485241dd17b7b7caf2c9fba1433280347dbae233e9",
          "actualSha256": "b0d9b29cbd36975d787eda485241dd17b7b7caf2c9fba1433280347dbae233e9",
          "match": true
        },
        "result": {
          "expectedSha256": "743b2b72e74a7fc149a9b43a51b4019d38ec5f5f2241608a1b5080bbfdce17fd",
          "actualSha256": "743b2b72e74a7fc149a9b43a51b4019d38ec5f5f2241608a1b5080bbfdce17fd",
          "match": true
        },
        "dml": {
          "expectedSha256": "217954ae86d3eb2e1a5093f4ef1d72d513b72ce127a286eff02970c2c634c750",
          "actualSha256": "217954ae86d3eb2e1a5093f4ef1d72d513b72ce127a286eff02970c2c634c750",
          "match": true,
          "expectedNormalizedStatements": [],
          "actualNormalizedStatements": [],
          "expectedRowCount": 0,
          "actualRowCount": 0
        },
        "lockOrder": {
          "expected": [],
          "actual": [],
          "match": true
        },
        "transaction": {
          "expected": "READ_ONLY",
          "actual": "READ_ONLY",
          "match": true,
          "expectedTimeline": [
            "GUARD_REJECTED"
          ],
          "actualTimeline": [
            "GUARD_REJECTED"
          ]
        }
      },
      "equivalenceRule": null,
      "verdict": "PASS",
      "receiptSha256": "9c64460d5b5145d8f3af7f20b8c4adcc8121b6a4d6465822334d4503cf9bc89b"
    },
    {
      "receiptId": "receipt:wave1:sql-repository-0dc3c380c54081a2:read_positive",
      "consumerId": "sql-repository-0dc3c380c54081a2",
      "proofMode": "DIRECT",
      "harness": {
        "harnessId": "harness:object-db-executable-parity:wave1",
        "harnessCaseId": "case:canonical-title-list-owned",
        "runner": "NODE_OBJECT_DB_PARITY_V1",
        "path": "개발환경_고도화/runtime/test/fixtures/object-db-executable-parity-harness.mjs",
        "sourceSha256": "bc1eea0a3d301679faba753c0922e9d7de3e1a67842372e74d545b10784b2ed5"
      },
      "fixture": {
        "fixtureId": "fixture:wave1:canonical-title-list-owned:v1",
        "path": "개발환경_고도화/migration-control/fixtures/synthetic-relational/object-db-consumer-executable-parity-wave1-title-list-owned-v1.json",
        "sha256": "e69bb41cd41442741014394812faf7acf5411e4d59ed758f649ddf0a5b29e94d"
      },
      "invocation": {
        "targetPath": "개발환경_고도화/runtime/test/fixtures/object-db-executable-parity-wave1-title-list-owned.mjs",
        "targetSourceSha256": "cf1d6e72f4574ee0b2a85318fd6dfded7bb94a97b006943dce046b95d2f6f0fa",
        "exportName": "executeWave1TitleListOwned"
      },
      "scenario": {
        "scenarioId": "scenario:read-positive",
        "scenarioKind": "READ_POSITIVE"
      },
      "expectedActual": {
        "reply": {
          "expectedSha256": "ee4584e8b0cdf207061c71a131185e12ff3adcd8cbf158b8ccaae70f35f25a4a",
          "actualSha256": "ee4584e8b0cdf207061c71a131185e12ff3adcd8cbf158b8ccaae70f35f25a4a",
          "match": true
        },
        "result": {
          "expectedSha256": "ee4584e8b0cdf207061c71a131185e12ff3adcd8cbf158b8ccaae70f35f25a4a",
          "actualSha256": "ee4584e8b0cdf207061c71a131185e12ff3adcd8cbf158b8ccaae70f35f25a4a",
          "match": true
        },
        "dml": {
          "expectedSha256": "217954ae86d3eb2e1a5093f4ef1d72d513b72ce127a286eff02970c2c634c750",
          "actualSha256": "217954ae86d3eb2e1a5093f4ef1d72d513b72ce127a286eff02970c2c634c750",
          "match": true,
          "expectedNormalizedStatements": [],
          "actualNormalizedStatements": [],
          "expectedRowCount": 0,
          "actualRowCount": 0
        },
        "lockOrder": {
          "expected": [],
          "actual": [],
          "match": true
        },
        "transaction": {
          "expected": "READ_ONLY",
          "actual": "READ_ONLY",
          "match": true,
          "expectedTimeline": [
            "READ"
          ],
          "actualTimeline": [
            "READ"
          ]
        }
      },
      "equivalenceRule": null,
      "verdict": "PASS",
      "receiptSha256": "9677a1144bb0ed3e1087c2d281dde77b4d2806982e7e2aee8e645e6d15aee748"
    },
    {
      "receiptId": "receipt:wave1:sql-repository-0dc3c380c54081a2:restart_consistency",
      "consumerId": "sql-repository-0dc3c380c54081a2",
      "proofMode": "DIRECT",
      "harness": {
        "harnessId": "harness:object-db-executable-parity:wave1",
        "harnessCaseId": "case:canonical-title-list-owned",
        "runner": "NODE_OBJECT_DB_PARITY_V1",
        "path": "개발환경_고도화/runtime/test/fixtures/object-db-executable-parity-harness.mjs",
        "sourceSha256": "bc1eea0a3d301679faba753c0922e9d7de3e1a67842372e74d545b10784b2ed5"
      },
      "fixture": {
        "fixtureId": "fixture:wave1:canonical-title-list-owned:v1",
        "path": "개발환경_고도화/migration-control/fixtures/synthetic-relational/object-db-consumer-executable-parity-wave1-title-list-owned-v1.json",
        "sha256": "e69bb41cd41442741014394812faf7acf5411e4d59ed758f649ddf0a5b29e94d"
      },
      "invocation": {
        "targetPath": "개발환경_고도화/runtime/test/fixtures/object-db-executable-parity-wave1-title-list-owned.mjs",
        "targetSourceSha256": "cf1d6e72f4574ee0b2a85318fd6dfded7bb94a97b006943dce046b95d2f6f0fa",
        "exportName": "executeWave1TitleListOwned"
      },
      "scenario": {
        "scenarioId": "scenario:restart-consistency",
        "scenarioKind": "RESTART_CONSISTENCY"
      },
      "expectedActual": {
        "reply": {
          "expectedSha256": "ee4584e8b0cdf207061c71a131185e12ff3adcd8cbf158b8ccaae70f35f25a4a",
          "actualSha256": "ee4584e8b0cdf207061c71a131185e12ff3adcd8cbf158b8ccaae70f35f25a4a",
          "match": true